{
  "schema": "lc0_browser.artifact_release_manifest.v1",
  "releaseId": "2026-06-23.bt4-qdq8.672059e.1",
  "generatedAt": "2026-06-23T21:13:53.186Z",
  "channel": "stable",
  "sourceManifests": [
    "public/models/lc0/r2-v0-present.manifest.json",
    "public/models/maia3/manifest.json",
    "public/stockfish/stockfish-18.0.7.manifest.json",
    "public/reckless/reckless-wasip1.manifest.json",
    "public/viridithas/viridithas-wasip1.manifest.json",
    "public/berserk/berserk-emscripten-single-thread.manifest.json",
    "public/plentychess/plentychess-emscripten-single-thread.manifest.json"
  ],
  "artifacts": [
    {
      "logicalUrl": "/berserk/berserk-emscripten-single-thread-corresponding-source.tar.gz",
      "artifactUrl": "https://assets.0x88.app/artifacts/sha256/01b9184b5193af4bd04e75fe0edc25fc025f132cb53a0f245e05cd0cb6dd0136/berserk-emscripten-single-thread-corresponding-source.tar.gz",
      "sha256": "01b9184b5193af4bd04e75fe0edc25fc025f132cb53a0f245e05cd0cb6dd0136",
      "bytes": 18427893,
      "file": "berserk-emscripten-single-thread-corresponding-source.tar.gz",
      "kind": "source",
      "contentType": "application/gzip",
      "sourceManifest": "public/berserk/berserk-emscripten-single-thread.manifest.json",
      "localPath": "public/berserk/berserk-emscripten-single-thread-corresponding-source.tar.gz"
    },
    {
      "logicalUrl": "/berserk/berserk-emscripten.data",
      "artifactUrl": "https://assets.0x88.app/artifacts/sha256/9b84c340af7e45f6e07f0046235ccb327f4ae0840c8ee2c4b97b99121e5c5084/berserk-emscripten.data",
      "sha256": "9b84c340af7e45f6e07f0046235ccb327f4ae0840c8ee2c4b97b99121e5c5084",
      "bytes": 25201924,
      "file": "berserk-emscripten.data",
      "kind": "engine",
      "contentType": "application/octet-stream",
      "sourceManifest": "public/berserk/berserk-emscripten-single-thread.manifest.json",
      "localPath": "public/berserk/berserk-emscripten.data"
    },
    {
      "logicalUrl": "/berserk/berserk-emscripten.js",
      "artifactUrl": "https://assets.0x88.app/artifacts/sha256/ab5dd3fd1b87cdd281cdb401e3714498a8520deccc0e83a464d49e316a85c279/berserk-emscripten.js",
      "sha256": "ab5dd3fd1b87cdd281cdb401e3714498a8520deccc0e83a464d49e316a85c279",
      "bytes": 66372,
      "file": "berserk-emscripten.js",
      "kind": "engine",
      "contentType": "text/javascript; charset=utf-8",
      "sourceManifest": "public/berserk/berserk-emscripten-single-thread.manifest.json",
      "localPath": "public/berserk/berserk-emscripten.js"
    },
    {
      "logicalUrl": "/berserk/berserk-emscripten.wasm",
      "artifactUrl": "https://assets.0x88.app/artifacts/sha256/0cffe539d41787c8cc2963911e24fe0bdf5319bae1fe03fae243642e8cda9372/berserk-emscripten.wasm",
      "sha256": "0cffe539d41787c8cc2963911e24fe0bdf5319bae1fe03fae243642e8cda9372",
      "bytes": 128172,
      "file": "berserk-emscripten.wasm",
      "kind": "engine",
      "contentType": "application/wasm",
      "sourceManifest": "public/berserk/berserk-emscripten-single-thread.manifest.json",
      "localPath": "public/berserk/berserk-emscripten.wasm"
    },
    {
      "logicalUrl": "/models/lc0/BT4-1024x15x32h-swa-6147500-policytune-332.batch8.f16.qdq8.onnx",
      "artifactUrl": "https://assets.0x88.app/artifacts/sha256/af5319e8aa5a240c26311c3f52f58b3e190734e028b081ac78432e652eb80b7a/BT4-1024x15x32h-swa-6147500-policytune-332.batch8.f16.qdq8.onnx",
      "sha256": "af5319e8aa5a240c26311c3f52f58b3e190734e028b081ac78432e652eb80b7a",
      "bytes": 186676343,
      "file": "BT4-1024x15x32h-swa-6147500-policytune-332.batch8.f16.qdq8.onnx",
      "kind": "model",
      "contentType": "application/octet-stream",
      "sourceManifest": "public/models/lc0/r2-v0-present.manifest.json",
      "localPath": "public/models/lc0/BT4-1024x15x32h-swa-6147500-policytune-332.batch8.f16.qdq8.onnx",
      "status": "symlink"
    },
    {
      "logicalUrl": "/models/lc0/lqo_v2.f16.onnx",
      "artifactUrl": "https://assets.0x88.app/artifacts/sha256/bbf9f08e995b7ed552e902c332f09daf79d761f383cde31036720553312fee03/lqo_v2.f16.onnx",
      "sha256": "bbf9f08e995b7ed552e902c332f09daf79d761f383cde31036720553312fee03",
      "bytes": 189397245,
      "file": "lqo_v2.f16.onnx",
      "kind": "model",
      "contentType": "application/octet-stream",
      "sourceManifest": "public/models/lc0/r2-v0-present.manifest.json",
      "localPath": "public/models/lc0/lqo_v2.f16.onnx",
      "status": "symlink"
    },
    {
      "logicalUrl": "/models/lc0/lqo_v2.f16.qdq8.onnx",
      "artifactUrl": "https://assets.0x88.app/artifacts/sha256/4effd3079add6ab04043f066057f987b54e90e7e54cdf62ac0931b300769fc0e/lqo_v2.f16.qdq8.onnx",
      "sha256": "4effd3079add6ab04043f066057f987b54e90e7e54cdf62ac0931b300769fc0e",
      "bytes": 95662716,
      "file": "lqo_v2.f16.qdq8.onnx",
      "kind": "model",
      "contentType": "application/octet-stream",
      "sourceManifest": "public/models/lc0/r2-v0-present.manifest.json",
      "localPath": "public/models/lc0/lqo_v2.f16.qdq8.onnx",
      "status": "symlink"
    },
    {
      "logicalUrl": "/models/lc0/t1-256x10-distilled-swa-2432500.batch1.f16.onnx",
      "artifactUrl": "https://assets.0x88.app/artifacts/sha256/34ed77d4eaf9f628980cb40eb026666467fae982ae58592a71aed80e8e6b3ac6/t1-256x10-distilled-swa-2432500.batch1.f16.onnx",
      "sha256": "34ed77d4eaf9f628980cb40eb026666467fae982ae58592a71aed80e8e6b3ac6",
      "bytes": 40491226,
      "file": "t1-256x10-distilled-swa-2432500.batch1.f16.onnx",
      "kind": "model",
      "contentType": "application/octet-stream",
      "sourceManifest": "public/models/lc0/r2-v0-present.manifest.json",
      "localPath": "public/models/lc0/t1-256x10-distilled-swa-2432500.batch1.f16.onnx",
      "status": "symlink"
    },
    {
      "logicalUrl": "/models/lc0/t1-256x10-distilled-swa-2432500.batch1.f16.qdq8.onnx",
      "artifactUrl": "https://assets.0x88.app/artifacts/sha256/9396c11226de7f29dbad8c60147b1082b8093adc7a0b77819cd0fb33103a095f/t1-256x10-distilled-swa-2432500.batch1.f16.qdq8.onnx",
      "sha256": "9396c11226de7f29dbad8c60147b1082b8093adc7a0b77819cd0fb33103a095f",
      "bytes": 20558031,
      "file": "t1-256x10-distilled-swa-2432500.batch1.f16.qdq8.onnx",
      "kind": "model",
      "contentType": "application/octet-stream",
      "sourceManifest": "public/models/lc0/r2-v0-present.manifest.json",
      "localPath": "public/models/lc0/t1-256x10-distilled-swa-2432500.batch1.f16.qdq8.onnx",
      "status": "symlink"
    },
    {
      "logicalUrl": "/models/lc0/t1-256x10-distilled-swa-2432500.batch1.f32.onnx",
      "artifactUrl": "https://assets.0x88.app/artifacts/sha256/9942420798729cfd3ba0f20ced7b1e9650dadc832527a5ad28f8b990ca0d230e/t1-256x10-distilled-swa-2432500.batch1.f32.onnx",
      "sha256": "9942420798729cfd3ba0f20ced7b1e9650dadc832527a5ad28f8b990ca0d230e",
      "bytes": 80895900,
      "file": "t1-256x10-distilled-swa-2432500.batch1.f32.onnx",
      "kind": "model",
      "contentType": "application/octet-stream",
      "sourceManifest": "public/models/lc0/r2-v0-present.manifest.json",
      "localPath": "public/models/lc0/t1-256x10-distilled-swa-2432500.batch1.f32.onnx",
      "status": "symlink"
    },
    {
      "logicalUrl": "/models/lc0/t1-256x10-distilled-swa-2432500.batch16.f16.onnx",
      "artifactUrl": "https://assets.0x88.app/artifacts/sha256/b48c352ad589a6466e9834524768f0643a67e1bc5ad44c6277dc01c69e322f13/t1-256x10-distilled-swa-2432500.batch16.f16.onnx",
      "sha256": "b48c352ad589a6466e9834524768f0643a67e1bc5ad44c6277dc01c69e322f13",
      "bytes": 40491226,
      "file": "t1-256x10-distilled-swa-2432500.batch16.f16.onnx",
      "kind": "model",
      "contentType": "application/octet-stream",
      "sourceManifest": "public/models/lc0/r2-v0-present.manifest.json",
      "localPath": "public/models/lc0/t1-256x10-distilled-swa-2432500.batch16.f16.onnx",
      "status": "symlink"
    },
    {
      "logicalUrl": "/models/lc0/t1-256x10-distilled-swa-2432500.batch32.f16.onnx",
      "artifactUrl": "https://assets.0x88.app/artifacts/sha256/c4b4b8dd9ad95b3d111dac851c06af88b3ca794e4953feb748cb678e65aedc46/t1-256x10-distilled-swa-2432500.batch32.f16.onnx",
      "sha256": "c4b4b8dd9ad95b3d111dac851c06af88b3ca794e4953feb748cb678e65aedc46",
      "bytes": 40491226,
      "file": "t1-256x10-distilled-swa-2432500.batch32.f16.onnx",
      "kind": "model",
      "contentType": "application/octet-stream",
      "sourceManifest": "public/models/lc0/r2-v0-present.manifest.json",
      "localPath": "public/models/lc0/t1-256x10-distilled-swa-2432500.batch32.f16.onnx",
      "status": "symlink"
    },
    {
      "logicalUrl": "/models/lc0/t1-256x10-distilled-swa-2432500.batch4.f16.onnx",
      "artifactUrl": "https://assets.0x88.app/artifacts/sha256/878ddb3f35de0cf96bd1ead1f5d74dca4e2a4005aa4d34ebee0a7d81ed79e511/t1-256x10-distilled-swa-2432500.batch4.f16.onnx",
      "sha256": "878ddb3f35de0cf96bd1ead1f5d74dca4e2a4005aa4d34ebee0a7d81ed79e511",
      "bytes": 40491226,
      "file": "t1-256x10-distilled-swa-2432500.batch4.f16.onnx",
      "kind": "model",
      "contentType": "application/octet-stream",
      "sourceManifest": "public/models/lc0/r2-v0-present.manifest.json",
      "localPath": "public/models/lc0/t1-256x10-distilled-swa-2432500.batch4.f16.onnx",
      "status": "symlink"
    },
    {
      "logicalUrl": "/models/lc0/t1-256x10-distilled-swa-2432500.batch8.f16.lc0web/model.lc0web.json",
      "artifactUrl": "https://assets.0x88.app/artifacts/sha256/3001f3bb692ebc02abfd575670d87a9db693c2e81a9ce23f73638265314c7c65/model.lc0web.json",
      "sha256": "3001f3bb692ebc02abfd575670d87a9db693c2e81a9ce23f73638265314c7c65",
      "bytes": 296585,
      "file": "model.lc0web.json",
      "kind": "model",
      "contentType": "application/json",
      "sourceManifest": "public/models/lc0/r2-v0-present.manifest.json",
      "localPath": "public/models/lc0/t1-256x10-distilled-swa-2432500.batch8.f16.lc0web/model.lc0web.json",